{
  "schema_version": "1.0",
  "project_id": "clr-2026-large-print-sudoku-for-seniors-easy-puzzles-with",
  "evaluated_at": "2026-08-16T17:28:08Z",
  "decision": "PASS",
  "verified_facts": {
    "item_count": 100,
    "content_verification_decision": "PASS",
    "audience_band": "senior-large-print",
    "is_large_print": true,
    "solutions_placement": "back-only",
    "all_unique_solutions": null,
    "difficulty_tier": null
  },
  "claim_sources": {
    "cover": {
      "count_label": "100 Puzzles",
      "declared_count": 100,
      "descriptor": "Large Print  •  Easy  •  Complete Solutions",
      "descriptor_parts": [
        "Large Print",
        "Easy",
        "Complete Solutions"
      ]
    },
    "text_blocks": [
      "listing_kit",
      "metadata"
    ]
  },
  "checks": {
    "count_matches": true,
    "large_print_valid": true,
    "uniqueness_valid": true,
    "back_only_valid": true,
    "difficulty_word_valid": true
  },
  "issues": [],
  "warnings": [
    "A uniqueness claim is made but solution uniqueness was not measured; verify before release."
  ]
}
